text,label
حسبي الله نعم الوكيل في كل ظالم مفتري الله يعين الشعب,Negative
حفظ سور جديده تسميعها فى الصلاه يساعد على التركيز,Positive
ضيعت دقايق من عمري بمشاهده ازنخ اتفه شخص بالحياه الا هو اللي بالنص لا حتى بعرف اسمه,Negative
انا دايما فرحان مش سائل بالدنيا الحمد لله,Positive
انما بعثت لاتم مكارم الاخلاق,Positive
اللهم اهدنا فيمن هديت وعافنا فيمن عافيت,Positive
من جد سوبر ابقار,Negative
الله يلعنك,Negative
الله يحمي البلد من كل مخرب والله يعطيكي العافيه رجال الامن العين السهره على حمايه البلد من اصحاب النفس المريضه انتم النشامى,Positive
جمال الصفحه من جمالكم رقي اخلاقكم انا متاكد ان صفحتنا ستعجبك فانضم الينا ادعو اصدقائك فنحن نسعد بك بهم,Positive
والله حرام الناس مش لاقيه توكل حتى ترفعو البنزين,Negative
المشكله ناس بتسمع حالها بالحمام هيه وبتغني,Negative
اللهم لا تحرم احد من هذه النعمه,Positive
ما اجمل من مثل هذا الحُب الصادق الشفا,Negative
مهيه خربانه ان شاء الله يعملو مفاعل قرد بطلت تفرق,Negative
عنجد بخزي,Negative
لاتحزن فان الحسنه بعشره امثالها الى سبعمائه ضعف الى اضعاف كثيره و السيئه بمثلها الا ان يعفو ربك يتجاوز فكم لله من كرم ما سمع مثله و من جود لا يقاربه جود,Positive
غبي انتا اشي الصووووت هاد بتشبهو بجورج وسوف,Negative
ربنا يقوي ايمانك,Positive
عنجد الكذب اكبر ورطه,Positive
تايم لاين اردني واعي ومثقف لفت انتباه زين الاردن لتغيير محتوى تغريدتها  شكرا لاحترامكم الراي العام في الاردن,Positive
فاشلين الى ما لا نهايه,Negative
الله ما يحرمنا من كلماتك الحلوه يا شيخنا,Positive
ونشوف اغلى الاحبه في الروضه الرحيبه,Positive
انا دمرت انا دمرت مستقبلي ضاع وما معي اكل خبز شو هالحياه شو هالقرف مش حياه الحياه كلها ظلم ما في شغل الاردن,Negative
لتصل الى القمه لا تلتفت الى مغريات الطريق,Positive
اللهم ثبتنا بالقول الثابت في الحياه الدنيا وفي الاخره,Positive
اللهم عفوك رضاك الجنه,Positive
الله خيرا من الدنيا وماء فيها و ما عليها السلام عليكم ورحمه الله تعالى وبركاته اخواني واخواتي,Positive
ولا جورج في الزمنات بس حرام يفضحوهم,Negative
حلو كلامك عزيزي,Positive
ربنا لا تزغ قلوبنا بعد ان هديتنا,Positive
لا تعليق,Negative
تنظرون لا الشام يقتلون بدم بارد,Negative
ما بدي غير 10 يعملو لايك للبيج,Negative
اهل العقول براحه ام نسيانك يابو نسيان صعب والله صعب,Negative
الحمدلله من كل ضيق اسجد لله احس ان فى اعله مستوا وانسا واتذلل الى الله ليحمينى من فتن الدنيا واحسن منزلى فى الجنه,Positive
الله يصبحك برضاه,Positive
شو الاشي الي بيضحك ما ازنخك,Negative
فهم ادرى واخبر لا وبل اكثر انكارا للشيعه وامثالهم,Negative
اللهم ارضنا و ارضى علينا,Positive
برامج سخيفه تهدف لهدم الامه,Negative
رعب وخوف على وجهك ياجبان,Negative
كلام رائع وفي وقته وربنا قادر علي كل شئ,Positive
ربنا اصلح احوالنا,Positive
بسعد ربك وصباحك عسل انت وكل من قال انا اردني وبحب القياده الهاشميه وتراب الاردن وسنح الاخوان ولاد كلب على هالصبح,Negative
النقاش العقلاني ينتهي يانك تقنع الشخص يا انك تقتنع اذا ما انتهى النقاش كذا واللي قدامك مصدي الحل الثالث تتفل بوجهه و بكذا يكون انتهى النقاش,Negative
للبرنامج التافه الي يسمح لهذا الشي,Negative
ياخساره العروبه فيك,Negative
اهلا وسهلا بشخصك الكريم,Positive
فاهجر تجد عوضا عما تفارقه,Positive
يعني ما اختار الا الاغنيــه اللي اغلب احرفها الحرف اللي يقرط فيه,Negative
وبعدين تري مالقت دعم,Negative
الحمد لله الذي رزقني بالاسلام,Positive
انت مو انت انت جوعان كل شوكولاته افرح,Positive
لا شو انا مسخره كلكو خنازير,Negative
يا حبيبي هاي صار للرجال تنانير؟ تفي هيك رجاله,Negative
اسوا شعب الله في الكوميديا,Negative
فعلا البت جده لما تحتاج ليه هو الانسان الصادق هو البستاهل تضحي عشان,Positive
هات ناس تفهم والمثل بحكي اسال مجرب ولا تسال خبيير,Negative
سخافات وتخلف شباب وصبايا هل الايام,Negative
دلوعه حيوانه?,Negative
صباحك طيب كطيب المسك العنبر,Positive
الله وكيلك مشحطط اهل دابوق دير غبار عبدون منعم على الفقراء,Negative
الحب الحقيقي عمله نادره فعلا وهو نعمه كبيره من الله عزوجل,Positive
استاذ عمرو يا ريت شويه تركيز على اخوتنا في بورما انهم يتعرضوا لحرب  حقيقيه,Positive
ضحكت طفل بسمه امل ,Positive
الله الله الله يحفظك يا مملكه الانسانيه لم تقتصر مساعده السوريين في الاردن علي المعونات الغذاييه او الطبيه بل حتي شنط مدارس الاطفال بكل شي,Positive
سلمت يمناك كلام من ذهب,Positive
من اهم مشاكل التعليم الجامعي في الجامعات الرسميه الاردن، مشكله الاعداد حيث ان كل جامعه متجاوزه السقف الاستيعابي لها بالاف الطلاب,Negative
انا انصح كل انسان ان لايكذب لان الكذب مداه قصير,Positive
تسلم انت وافكارك,Positive
مستحيل اثق بذوق حدا ما بحب يسمع لام كلثوم,Negative
نعم الوقت يمر بسرعه,Positive
عاهات وعهد الله عاهات ايه اللي خلاهم يغنو دول,Negative
شو عاجبك فيها مثلا ؟ لتكون سيارتكم,Negative
مين معو دوا للصراصير جد لازمهم رش مبيد حشري للقضاء على هيك حالات متخلفه,Negative
قصه رائعه افادك الله من العلم لتفيدنا دائما,Positive
كلامك يشعرني بالتفاؤل يمدني بالقوه الاستمرار,Positive
صح يا اخي صدقت الله يعين الجميع,Positive
اللهم اجعلني من يتشرف به الاسلام,Positive
مشاهد وسخه,Negative
تؤلمني باسم الحب,Negative
شكلك دايما متاخره عن المدرسه,Negative
زهايمر وخرف وحبتين كبتاجون,Negative
اني احبك في الله,Positive
الله على الكلام يا رب اعينا,Positive
للهم املا قلبي بحبك وحب نبيك وحب كل عمل يقربني الي حبك,Positive
مشتاقه لك شوق ماحسه الناس شوق يغطي معاليق الروح بضمي ترف دلع لهفه مشاعر واحساس ماابي غيرك ولاغيرك تراه همي,Positive
اللهم ارزقنا كما ترزق البغاث تسلميلي هنوده حلوه كثير الله يفتح عليكي يهدينا اياكي,Positive
بارك الله فيك انا نضال فدعولي بزوجه صالحه,Positive
لان ما بعتقد انو في هالقد عاهات ما بيعرفوا انو صوتهم نشاز لانو كتيير نشاز وازا في رح تكون حالات استثنائيه مو بهاد الكم الكبير,Negative
فاشل فاشله برنامج فاشل,Negative
هؤلاء معوقين,Negative
الله اكبر ولله الحمد مصر بخير فيها ناس كتير طيبين,Positive
فعلا في البدايه كلهم رائعون,Positive
صباحك ورد ياسمين معطرين بنسمات من الجنه يا شيخنا الجليل حفظك الله من كل سوء نحبك في الله,Positive
نعم الاخ وما اطيب قلبه,Positive
يالا من هون كس امك انت و هو، بلاش قرف و وساخه,Negative
سابقى رائعا معك الى النهايه ان بقيتي رائعه معي الى النهايه,Positive
ما يستحون هم جايين لو انا منهم اروح اقشر بصل,Negative
رح اجتهد باني اكون حلوه يوم عرسي مش اكون مثل القرده,Negative
حفظ الله ابناء وبنات الامه جميع,Positive
رغم انني اول من اثار فضيحه في المناهج المقرره في الاردن طوال عقود مضت ، و عوقبت بالفصل عده مرات من التربيه,Negative
الاردن كان افضل حالا بمئات المرات في التعليم و الصحه و الزراعه و الاستثمار ... التردي ليس مرتبط بالربيع العربي بل قبله بمده عام,Negative
الظاهر عقلك تافه من اصحاب العقول المقفله,Negative
انا لو مكان راغب اروح انتحرر,Negative
ليت بعض الذكريات ينعمل لها فورمات ,Negative
و الى اسماء الاسد كـــس اخـــت زوجـــك :,Negative
الف الف مبروك يستاهل والله يوفقكم,Positive
خسئو وخسئ امثالهم ومن طاوعهم,Negative
شباب صايع مو ملاقي ياكل مخه فاضي متخلف عقليا,Negative
كاميرا خفيه في الانحطاط الاخلاقي,Negative
انه دين يسر وليس بدين عسر,Positive
اللهم اصلح حال المسلمين اجعلهم من الرباتين حتى نحرج مما نحن فيه لانه ان خلصت النوايا صلحت الاعمال,Positive
اما الغبي اللي يقلد جورج وسوف,Negative
اللهم لا تجعلنا من المنافقين,Positive
ولا مستحيل يطلع واحد يفشل نفسه كذا,Negative
حكي فاضي,Negative
لا ياس مع الحياه,Positive
صباح الخيرات والعبادات,Positive
لعن الله المتشبهين من الرجال للنساء,Negative
خير الكلام ما قل دل,Positive
الى يقارن بينه وبين مرسى يبقى متخلف,Negative
دي اخلاق السلف الصالح,Positive
ان الدين عند الله الاسلام هذا هو الدين الذي يجب ان يعتنقه كل انسان علي وجه الارض وليس العرب فقط اللهم اهدي غير المسلمين الي دين الاسلام,Positive
فعلا مهزله,Negative
الحلال بين و الحرام بين واتقوا الله,Positive
واعظمها امه سيدنا محمد,Positive
يلعن ام الازعاج,Negative
يارب يقدرنا على ادخال المياه النظيفه لكل بيت محتاجه المياه,Positive
انا اخدت قرار وبعدت عن معصيه لله وقدرت وربي وفقني,Positive
فيروسات بشريه,Negative
تغني وهي متقرفه,Negative
ايه راحه فيها المسكين ياحرام,Negative
عدوله السامج هذا خرب اوم المقطع قسسم زباله هالادمي ودمه زززفت انا ضحكت,Negative
اللهم ارزق ابناء المسلمين زوجات صالحات وبنات المسلمين ازواج صالحين,Positive
لا عنجد زلمه شكلو بخوف,Negative
البرنامج الي بعد سوبر ستار الي يقلده دم ثقيل,Negative
اللهم استرنا وجميع بنات المسلمين,Positive
للهم اعنا على ادراك هذا المعنى العظيم يا رب,Positive
صباح الفل الورد يا شيخ سلمان عطر الله صباحك بذكره شكره حسن عبادته,Positive
الله يثبته يا رب ويثبتنا نحن كمان,Positive
البقاء في الخيال دمار,Negative
خراي على احسن علوي ومحب لهاجحش خربت سوريه ياكلب,Negative
احتمال ما يشارك الليو البايخ,Negative
هذا تشهير ملعون والدين المفروض ما يعرضونه,Negative
نعم فى البدايه كلهم اروع من الروعه,Positive
ربما تنام وعشرات الدعوات ترفع لك، من فقير اعنته او جائع اطعمته، او حزين اسعدته اومكروب نفست عنه، فلا تستهن بفعل الخير,Positive
عاهات العرب الجرب,Negative
انني كومه من القلق والرجفه اكثر من كوني انسان,Negative
ربنا يبارك فيه يكون قدوه للجميع المسلمين فى انحاء العالم,Positive
اخرس صحيح ما تفهم,Negative
دمرني النصاني هودعيك يربي بطني,Negative
توكلت عليك يا الله,Positive
اقسم بالله ان العرب اكثر الشعوب تخلفا,Negative
اللهم اهدنا لكل عمل يقربنا اللى حبك,Positive
مفيش اجمل من ان الانسان يحافظ على كرامته,Positive
نعم الله علي اكثر من ان احصيها الهدايه ، الصحه، سلامهالقلب، ذكاء العقل، صفاء المشاعر ، سلامهالحواس، حفظ الاحباب اللهم لك الحمد,Positive
واحد واطي,Negative
كلهم فاجرين,Negative
اغرورقت عيناي بالدموع,Negative
الوفاء في غير قلبك ما لقيت,Positive
طول عمر بخاف ان امثالك يصبحوا مطربين,Negative
حطمت كل احلامي البريئه,Negative
الاسلام نعمه كبيره من عند ربنا لا تقدر بكنوز الدنيا كلها,Positive
مقال رائع والله يهدي البنات يارب ويرجعهم للصواب,Positive
اللهم اجعلنا من يتمتعون بروح و ريحان و جنه النعيم من الرحمن صباحكم قطرات من ندى الازهار,Positive
اﻻسلام ليس فيه رهبانيه انما هو دين علم وعمل وبحث وتطوير... وعندما طبقنا هذا المبدا سدنا العالم,Positive
شي مؤكد انك حمار,Negative
افعال لا تضاهيها اقوال,Positive
جميله اوى اوى اوى يارب الكل يحس معنى الكلام ده,Positive
اللهم اعنا على انفسنا اجعلنا نرى الدنيا صغيره الاخره كبير,Positive
متسمم فكره الولد وصارت حالته صعبه يا حنين انت,Negative
يرزق من يشاء بغير حساب,Positive
اللهم احينا وامتنا على الاسلام وعلى كلمه لا اله الا الله,Positive
اسعار البنزين مرتفعه في المملكه الاردنيه الهاشميه والشعب اغلبه فقير وماشيه الحياه بدون اي مشاكل لكن اللي يقهرك ان الاردن لا تنتج البنزين,Negative
بصفحات الفيزا على جواز السفر حاطين صور اثار الاردن عاساس هيك بس اشوفهم رح احن و ابطل اسافر,Negative
بالله تسكتوا خلينا بحالنا بدناش مشاكل ايه,Negative
انا فعلا مؤمن بالفكره دي جدا وبحاول انفذها,Positive
رئيس مو عارف يحكي حرف الاس روح تخيب ولك يلعنها انيسه على هيك جحش خلفتو,Negative
حثاله شباب صايع,Negative
حسبنا الله ايش صاير لشبابنا الحشيش والمخدرات غزتهم الله يهونها ويحفظ شباب وبنات الاردن,Negative
والله حرام والله موتوه لشعب الاردني من وين بدنا نجيب الكو من وين يا الله ارحمو من في الارض يرحمكم من في السماء الله حرام,Negative
صح الابتسامه تصنع السعاده,Positive
اللهم وفقنا لما تحب ترضى يا رب,Positive
وعرض اختي انك لاسع يادمن عساس لو بدها تضرب من هسه خايفه منك,Negative
كلنا ما انتصرنا على نفسنا وعلى الحاجه ددي الي متعبتنا ومبعدتنا عن الله,Positive
وش هالتحف والله مساكين ماكلين مقلب بقوه,Negative
بارك الله فيك نتمنى المزيد من النصائح,Positive
هي فلسطين راحت من قليل يا ولاد المخنثه لعنه الله عليكم فظحتونا,Negative
كارثه بشريه,Negative
حرف الراء مصيبه ريس,Negative
دعوه اخاك بظهر الغيب لا ترد,Positive
الطاقه الشمسيه هي البديل وليست الطاقه النوويه,Negative
هو رحيم بكل شىء في الكون هو الخالق فلابد ان يرزق مخلوقاته,Positive
صباح الخير والسعاده لكم,Positive
الاردن لا تمتلك اي الخبرات الفنيه في انشاء او صيانه او تشغيل المفاعلات النوويه لاردن ليس لديها سوى شهادات دكتوراه في هذا المجال نظريه بحته ان انشاء مفاعل نووي يعنى مقامره كامله بمئات الملاييين المضحك في الموضوع ان بدايه المشروع ستكون انشاء مفاعل تجريبي او تعليمي يتبع لهيئه الطاقه النوويه اليس الاجدر بهكذا مفاعل ان يتبع لاحدى الجامعات علاوه على ان كل هيئه الطاقه تم انشاها رضوه لفلان وعلنتان الاولي يا ساده ان يتم طرح انشاء شركه للتنقيب عن اليورانيوم وبيعه لتصبح الاردن دوله مصدره لهذه الماده امر اخر كثر الحديث مؤخرا عن انه يوجد في الاردن بترول بكميات على الاقل تكفي استهلكنا المحلي,Negative
مرره دلوع,Negative
ربنا يقوينا ويقدرنا,Positive
فما اجمل هذا الدين,Positive
حماك الله من النكد,Positive
اللهم اصلح حالنا وشاننا كله واجمع لنا خير الامور,Positive
تضحك كانها مفجوعه من شيئ,Negative
وش يحسون فيه يع,Negative
لازم يحكم عليهم بالسجن,Negative
يسعد صباحك بذكر الرحمن,Positive
الحمدلله على السلامه وماتشوف شر .. طهور وقدامك العافيه ان شاء الله,Positive
من يتوكل على الله فهو حسبه,Positive
احقر من هيك خيانه ما في,Negative
فعلا احس في نفسي دللك,Positive
ان الله هو الرزاق دو القوه المتين,Positive
عادي محنا اتعودنا على الرفع من يوم يومنا نحن ما بنعرف غير الرفع همه برفعو نحنا بندفع على حسابنا,Negative
مثل الاميره من حواليها حرس تمشي دلع و من الترف متعاليه ما كل خيال يروض له فرس مهره اصيله من حلاها غاليه,Positive
الحق مش على لجنه التحكيم الحق على الاغبيه المشتركين,Negative
ايها الصغار المتناكفون انكم مع كل منشور ضد بعضكم البعض تصغرون اكثر مما انتم صغار فلا يسلك هذا الطريق الا صغير ساذج يحب ان يعيش على القذارات,Negative
اترك ما تهوى لاجل من تخشى,Positive
وجعلنا من الماء كل شيء حي,Positive
والله الحياه كلها بتخزي بدونكم,Negative
اكيد بقرف,Negative
اللهم ارزقنا العمل الصالح الذريه الصالحه ارزقنا يا الله حسن الخاتمه,Positive
لا والله ما بلسه يع,Negative
اللهم اهدنا صراطك المستقيم,Positive
ان النجاح يحتاج الي قلبا ثابت عقلا راشد طموحا واعد تحدي كاسر,Positive
يارب طهر قلوبنا يارب اهدينا للصواب,Positive
اكاديمي اللي خلفت عاهات للفن المعاق حاليا فيزيدون الطين بله,Negative
والله انك مسخره يا عجوز,Negative
يا سلام على الوفاء اللي اتفقد في عصرنا ويا حسرتاه على الحب الذي بات مجرد كلمات,Positive
كيف لا احبه و في كل مساء يهديني شيئا من روحه ,Positive
نحن نحبك في الله ندعو لك بظهر الغيب,Positive
ما اجمل الكلام والاروع ان نطبقه,Positive
ماكل روح الخل,Negative
كدا عيب اودني راحت فيها,Negative
ظني بالله جميل,Positive
يا رب ارزقنا الفرح والسعاده,Positive
سخيفه قوووه,Negative
ربنا يعيننا علي نفسنا,Positive
ليش تتضحكو مش حلو,Negative
ربى يزيدن ايمان وتقه يارب,Positive
الزعل بدايه الطريق للامراض,Negative
فطست ضحك على الشايب,Negative
قولى يارب ثم توكلى عليه انه نعم المولى نعم الوكيل احتسبى عنده ما تظنين انك لا تقدرين عليه,Positive
كلب واطي,Negative
اللهم اني اسالك اخلاص النيه كرم الطويه,Positive
كلام جى فى وقته,Positive
اكيد ماحدا بيقدر يارب اعن الفقراء واعنا مساعدتهم,Positive
صح الصح كمان,Positive
كلهم معندهمش احساس,Negative
للي مفكرين المفاعل راح يطورهم المفاعل راح يدمر الاردن المنطقه اللي حولها لان الفساد الموجود بالاردن مش موجود بدوله اخرى هذا يعني ان الفاسدين رايحين يسمسروا يلهفوا لما يوصلوا اشكل مفاعل للاردن ناسين ان المفاعل يحتاج الى بحر ماء للتبريد نحن لانملك ماء للشرب ناسين ان التطور يكون بمشاركه الجميع ليس بقرار فردي ناسين ان الذي اقر المفاعل هو المحتكر الاول هيئه الطاقه ان شاغرها بقي معلق اثناء فتره تسلم طوقان وزاره التربيه والتعليم لدول المتقدمه بدات تبحث عن بدائل للمفاعلات نحن بنشتري الخربان منهم مشان التقدم بلدنا بفضل الله لديها طاقه الرياح طاقه الشمس لماذا لا يتم استغلالها بدل المفاعل النووي طالما اكلنا معظمه فاسد غير صالح بسبب الجشع الطمع الفساد,Negative
مشان الله حد يعمله هوشه بدنا نعطللنا شوي,Negative
اللهم استخدمنا في طاعتك,Positive
اللهم اغفر له وسع لك رحمتك له اصلح له ذريته,Positive
بجد موضوع رائع وانا اجد انه مناسب ايضا لهذا الوقت يارب احفظنا من جميع الفتن,Positive
هذه رويدا عطيه يا الخبوول,Negative
سبحانه يهدي من يشاء لا اله الا الله محمد رسول الله,Positive
الله المستعان على كل ظالم فليس باليد حيله غير ان نقول لا حول ولا قوه الا بالله,Positive
صباح التفكر,Positive
و هكذا جنت على نفسها براقش,Negative
يا رب اللهم اجعلنى خير مما يظنون اغفر لى ما لا يعلمون,Positive
الله يكثر الافراح,Positive
هاي نتيجه انه ينحط انسان في موقع مسؤوليه,Negative
فدمك عود مع عنبر,Positive
اللهم اجعل لنا ايمانا صادقا قلبا خاشعا علما نافعا,Positive
صباح الاماني الجميله المحققه باذن الله,Positive
يا مصلح القلوب اصلح احوالنا يا مسهـل يا رب,Positive
كان نفسي اكون شخص بارد ، يتقبل اي حاجه من غير ما يتاثر.,Negative
تسلم صرمايتك,Negative
