text,label
والله نفسى بس الواحد بيجى عليه فترات ينسى يعمل ايه بجد,Positive
والله اول واحد سمعته منهم احسب سماعتي خربا يا بطني من الضحك والله زاحفين,Negative
اللهم لا شماته ليش ياربي يحرجوا انفسهم,Negative
فعلا ان الطموح هو سر النجاح,Positive
ان شاء الله ربنا يعينا على فعل الطاعات,Positive
اللهم اهدنا الى صراطتك المستقيم,Positive
الحريه غاليه لن تجدها عند متسول اخواني ساذج لايملك منطق ولافكر,Negative
الحمد الله على الاسلام يا رب اهدي كل من احب هذا الدين وكل من تردد في دخوله وارحمنا جميعا,Positive
الله يهدي النفوس ربي ابعث لنا في هذا اليوم فرح يغير ايامنا وينعش قلوبنا من جديد,Positive
الدول المتقدمه الان تتجه لستخدام الطاقه المتجدده لانها اقل كلفه وليس لها مخاطر على البيئه والانسان ونحن الان نعاني من ضائقه ماليه كبيره وشحه مياه شديده وكلنا يعلم مدى حاجه المفاعل للمياه اذكركم فقط بما حدث في اليابان وهي الدوله الاكثر تطور في مجال التكنولوجيا وهي عباره عن جزر وكذلك كم اثر علينا المفاعل النووي الاسرائيلي وحالات السرطان المنتشره ولو لاحظنا التشوهات الخلقيه الاكثر في جنوب البلاد,Negative
يا مقلب القلوب ثبت قلوبنا على الاسلام,Positive
يارب اهدنا وقوى عزيمتا الى ما تحب وترضى,Positive
الفلاكا تجعل من يتناولها يعتقد انه زومبي واكل لحوم البشر ويبدا بالبحث عن دم ليشربه وظهرت في التسعينات في امريكيا ثم اختفت,Negative
اقسم بالله قرف المريض نفسيا للابد يبقى مريض نفسيا,Negative
معلم في حقيقه عمله هو مدرب يدرب طلاب على اكتساب المعرفه لا مجرد تلقيها,Positive
ولا شكل ولا صوت منين جايبينهم هالكائنات الغريبه اه يا بطني بس,Negative
قصه جميله تعلم الناس كمان الامانه لان اذا اخذ القليل اخذا الكثير,Positive
كرامتى اولى,Positive
يارب دعوناك فستجب لنا وحقق لنا ماهو اصلح وافضل لنا,Positive
روح موت وانتحر,Negative
ستضافتهم وعاملتهم معامله انسانيه ولم تحصرهم في مخيمات تفتقر لادنى مطلوبات الحياه مثل الاردن,Positive
مش عارف ليه بيتحوله هما الى دواره عليك وكان نفسهم تكون معاهم فى الاول,Positive
ما اجمل الاخاء,Positive
هذول مجانين اكيد ما بوافق مش هبله انا,Negative
بصمات راقيه لاديب الدعوه محمد الغزالي,Positive
اقترح تحويلهم الى طبيب نفسي ليس الى القضاء,Negative
حثاله على حثاله والحثاله انظف منهم,Negative
متفقين معهم البرنامج خايس,Negative
الحمد لله كلما ارى ناس اسلموا تعم الفرحه في قلبي,Positive
الى اعتصام مفتوح ميدان تحرير للتخلص من قوى الفساد الافساد,Negative
عيب والله اسم المقطع,Negative
اجل الاخير واضح انو بيمثل وتمثيلو خام هو والا معو,Negative
من وين انجيب حرام عليكم,Negative
حتى بالستايل مقلده الله ياخذ عمره الغبي,Negative
طيب انا عايزه اشوف القصر,Positive
ما اجمل الحياه برضى الله,Positive
القلب الذي يؤمن بالله  لا يياس ابدا  لانه يسير نحو النور واﻷمل .. والحياه ..,Positive
حلوه وهي ساكته اذا ابتسم كرهت شكلها,Negative
ريحتك طلعت,Negative
مقرف جدا هذا الشخص,Negative
اللهم اعز المسلمين,Positive
ياريت حدا عم يواسي السوريين بغربتهن للاسف باب رزق جديد للعرب,Positive
لو سمحت لا تقول اخبار مغلوطه ولا ابعطيك انفولو جيب رابط الخبر وبلاش تصرف من راسك,Negative
لا تقنتوا من رحمه الله فهي وسعت كل شيء مهما عصينا فلنا رب كبير رحيم ورحمن,Positive
من يتقي الله يجعل له مخرجا,Positive
اكثر بني ادم يعاني في الحياه هو المغترب بين الاردن والسعوديه لا اللي هنا فاهين عليه ولا اللي هناك والكل ما بحبو,Negative
شنو السالفه يعني اتقارنون القران الكريم ويه نجوه كرم هاي العرمه لا الله الا الله,Negative
وبكل تبلد اعترف لكم  باني اقل نساء الارض صبرا,Negative
كلو حكي فاضي,Negative
صلوا علي من بكي شوقا لرؤيتنا,Positive
الصادق ينتظر الفرج ولا يياس من روح الله,Positive
عالم فاضيه بيسمو الغناء فن بيشغلو الناس,Negative
بالله عليك فين الاناقه في الناس اللي بتغني دي,Negative
ان الله لا يتخل عن عباده ابدا,Positive
انتو كلاب ازى تسو المصحف بى كلابه زى ده,Negative
مش من بني ادم انتي من جنس الحيوانات,Negative
معلومه ممتازه,Positive
يا رب قويني علي نفسي يا رب تقبل منا الله,Positive
عــرب جـــرب,Negative
و يرزقكم من حيث لا تعلمون,Positive
يارب انت المستعان فاعنا واهدنا يارب الكون اجمع استجب,Positive
كنا نقول البلد حاميها حراميها ماذا سنقول الان مفتيها حراميها الله الواحد تحير في هذه الامه التي اصبح الحليم فيها حيران,Negative
صباحات العقول اليقظه الهمم الحييه المتوثبه,Positive
شعوب تافهه همها الحياه الدنيا فكروا في نهايتكم,Negative
صباح الورد الجوري الحمر والخمري,Positive
لسنا مجبرين على تبرير المواقف لمن يسىء الظن بنا من يعرفنا جيدا يفهمنا جيدا فالعين تكذب نفسها ان احبّت ,Positive
والله انكو ما بتخافوالله,Negative
موضوع اكتر من رائع,Positive
حبيبي شرلبوني يموت شرلبونا انا مدريدي? لكن ماني مغير لعيونه,Negative
ضع امنياتكم في سجده انساها وتاكد ان الله لن ينساها ابدا,Positive
شكلك احول موب حوله,Negative
يلعن ابو التخلف والغباء والبياخه,Negative
حسبنا الله نعم الوكيل في اناس همهم تجويع الشعب,Negative
الظاهر انه جايين يستهبلون عالحكام بس,Negative
افتخر اني مسلم نعمه من نعم ربي,Positive
دعوه المؤمن لاخيه بظهر الغيب اسرع من البرق,Positive
بجد ربنا يبارك فى كلماتك بتوصل والله,Positive
اللهم ارزقنا واياك الجنه,Positive
الاكل زاكي كثير كثير,Positive
نعم لنجعل حب الله هو الغايه وربنا يسامح كل تائب,Positive
فعلا برنامج ساقط واللي بيتابعه اسقط منه,Negative
اللهم تب علينا انك التواب الرحيم,Positive
طلعوا العرب اخس واخس واخس,Negative
حرام والله حزنت عليه شو هالموقف الشنع,Negative
ان من صفات الاسلام الامانه,Positive
اعمل ليومك غدك كن متفائلا دائما يا صاحبي,Positive
حرام عليك كانو بقره بتولد,Negative
فشلوه مره صدق انهم دلوخ,Negative
اللهم اعني على ذكرك شكرك حسن عبادتك,Positive
صباح السعاده العامره,Positive
لوين ندكم توصلونا الله هموم المصاريف قتلت الصغير قبل الكبير الله ياخذ حقنا منكم لا يباركلكم,Negative
صح علشان كده منكذبش ونرتاح,Positive
يا الله استجب دعائي يالله مادكيت بابك يوم ورحعتني خاليه الوفاض,Positive
صادقه وفنانه من الزمن الجميل والفن اخلاق واحساسها يدرس,Positive
فى ناس كتير ربنا كرمهم بنعمه الاسلام ولكنها لا تدرك قيمتها,Positive
واطي وماجور وسافل ومنحط وكريه وغبي وسطحي وحقو قرش مصدي وبيسوى صرمايه,Negative
تخسا هما وكل واحد بشد على يدهم مشكلتو شعب سوري يدعون البراء وهم في قمه النذاله,Negative
يعني لو عايزين يبعوه بلغوني من القرف هاض يع يع يع,Negative
مثال جميل جدا عبره لكل من يحمل رساله الاسلام,Positive
انا الوحيده الي احس طعم الببسي كنه حديد مصدي,Negative
اللهم اكفني بحلالك عن حرامك واغنني بفضلك عمن سواك يا رب,Positive
ثكلتك امك,Negative
لهم صارو يبيعو يشترو في البلد متل ما بدهم,Negative
الكرامه فوق كل شيء,Positive
انت واحد عنجد قليل ادب الله يموت الي امثالك,Negative
 كله رائع بجد ربنا يكرمك,Positive
يارب توب علينا وساعدنا نتوب وبصرنا بعيوبنا لان ساعات كتير بننسه,Positive
على فكره المعلقين هدول ولاد حرام,Negative
عذبت ام العود,Negative
اللهم باركي فيه واهدي كل مسلم لطريق النور,Positive
يجب على الحكومه العوده بالتوقيت الى الساعه الثالثه,Negative
شاهد تحرش جماعي بسيده تحمل طفلها على كورنيش,Negative
ما بكره حد قدك,Negative
هل الثقه بالمشتركين الزياده لدرجه العمى او ان محيطهم يجاملهم بجمال صوتهم,Negative
العجوز هذا والرجال الي بجنبه بله واغبياء وانهم يثبطون الواحد,Negative
صح لسانك,Positive
ربي ينعم علينا بنعمه الخشوع,Positive
حلو الشخص يكون عنده هدف يشتغل عليه لكن الدراسه شئ ضروري,Positive
يا اخوان نحن قرفنا,Negative
هاكدا هو دين المحبه الصحيح بس للاسف الكثيرين يتبنوه حسب ما يشتهون,Positive
صور جميله,Positive
اللهم يا محول الاحوال حول حالى ان احسن حال,Positive
طول عمرك تخاف من الحب ,Negative
وان مدحتك بالقصائد ماوفيت,Positive
اللهم ارزقنا الصدق الاخلاص,Positive
ساعات اللى فى السر هو اللى بيخلى الناس تحبك فى العلن من غير ما يكونوا عارفين الا انهم بيحبوك من غير سبب,Positive
والله احلا شيء انه الواحد يهاجر او يشتغل حرامي عشان يقدر يعيش الله لا يوفق الي كان السبب الله حرام,Negative
اوقف القرار للحفاظ على الوطن,Negative
الللجنه ما تنطاق,Negative
والله لو طلبوا مين اللي عندو قلب قوي ??? متر للجري مايتقدم ولا حمار عربي,Negative
المغرب بريء منك على الاقل اذا كنت لهجتنا صعبه فتكلم باللغه العربيه,Negative
اذا الخبر صحيح انا اول شخص بطالب بالهجره لاي دوله خليجيه او اوروبيه او حتى اسرائيل,Negative
الي انا شايفو انو المفاعل راح ينعمل في الاردن راح يخدم دول تانيه يعني مش عشان سواد عيونا,Negative
لاتتحدث بقوتك امام ضعيف ، و لا بسعادتك امام حزين ، و لا بمالك امام فقير، زن كلامك و راع شعور الاخرين,Negative
رب فعل صغير يستعظمه غيرك خاصه ان كنت تمثل الاسلام,Positive
الفاشل من يياس ويقف عند اول حاله رسوب,Negative
الاعتداءات على المعلمين والاطباء ... جرائم لا تقبل اي تبرير,Negative
نشاطر اخوتنا في الاردن احزانهم على الاغتيال الوحشي للطيار  معاذ_الكساسبه داعين الله ان يكون من الشهداء و ان يسكنه فسيح جناته ,Negative
ربنا المستعان ادعولنا ارجوكم,Positive
سبحانك ربي اني كنت من الضالمين,Positive
اللهم اجعلنى خيرا مما يظنون اغفر لي ما لا يعلمون,Positive
انا انجنيت,Negative
بعرف بس مو حلو,Negative
من يوم شفتك حاطه صورتك غسلت يدي منك,Negative
اسخف لجنه تحكيم شفتها بحياتي,Negative
كس امكم يالعرب يابهايم يابقايا حضارات الامم,Negative
كل شخص فينا بيتمنى الخشوع في صلاته يا رب يتقبل صلاتنا صيامنا,Positive
جميله المعاني المجرده التي تنزوي عند التطبيق,Positive
كن مع الله لا تبالي,Positive
صباح الدرب للجنه وبلبل شادى بفنه وريحه الياس والحنه اقولها لكل احبابي اللهم اجعلنا ممن يتمتعون بروح وريحان وجنه النعيم من الرحمن,Positive
يا الله ما احلاه من خبر والله فرحتوني,Positive
قرف يعيع,Negative
يارب اعيني علي دكرك وشكرك وحسن عبادتك,Positive
لا ياعزيزتي انا عايشه بالمحكمه واشوف تسلط وظلم كبير من اشباه الرجال بس بالنهايه المظلومه تجد من ينتصر لها وبكل هدوء بدون افلام,Negative
مش عارف كيف اهلهم سمحولهم يقدمو في البرنامج هادول شغل بطون,Negative
فقد عجزت الكلمات,Negative
ليت كل ايام السنه رمضان,Positive
بس اللي قاهرني اللي ما ينطقون حرف الراء التغ من جدهم جايين يبون يغنون,Negative
حلو...نفس العرطه سمعناها قبل 4سنين...طيب تصرف وسوبديلك اشي يرفع اقتصاد البلد,Negative
يارب ناخذ القرار الصح,Positive
نحن ما بدنا اياه لانا ما منفهم المفاعل النووي فوق طاقتنا صعب علينا بكره بذكركم سالوا الباص السريع الثقه معدومه القمح فاسد المصفاه مش حسب المواصفات الخضار الفواكه مواد كيماويه شوارع مش مصانه حفر مطبات الخ الافضل استغلال الطاقه الشمسيه او الريح او الماء ليس هروب من التطور انما الابتعاد عن الفشل الاكيد عبر التجارب,Negative
هدا ماهو عقل هدا تخلوف,Negative
صدقت يا رب اجعلنا راضين بقدرك,Positive
حالات مرضيه نفسيه مستعصيه لا يستطيع شفائها لا العلم لا الفن,Negative
لا احنا نتبع نظام مختلط بين الراسماليه والاشتراكيه,Positive
هذا ليس مضحك بل مخزى يا للخزى العار,Negative
شعب سخيف,Negative
الشو اسمو ستار اكاديمي ولا المسخره عل العالم اكاديمي,Negative
كلام سليم الف بالميه الله,Positive
يارب اعنا علي ترك المعاصي ماحيينا,Positive
لا تفهمي غلط حبيبتي,Negative
ربنا يعنا علي كل شيء,Positive
صباح الوفاء لك يا صديقي,Positive
نعم الاخ و الصديق اخلاقك تدرس,Positive
text,label
رحمه الله رحمه واسعه واسكنه فسيح جناته .. نعم الدكتور ونعم الداعيه ونعم الاب ونعم الصديق .... مخلص في عمله ... صدوق في دعوته,Positive
الله يوفقكم والله يجعلكم تفوزون كلكم معنا قولوا  امين ,Positive
"لا تحاول لفت انتباه احد , ان لم تكن ملفت بالفطره ستبدو احمقا بالتظاهر",Negative
ساعد نفسك بنفسك حتى تجد الطريق المناسب الذي تريده، اكتشف قدراتك واستغل مواهبك ولا تترك نفسك لحيث تاخذك الرياح فينتهي العمر قبل ان تحقق حلمك!,Positive
المومين الى بعضهم كالبناء الزى يشد بعضه البعض,Positive
ومن منطلق المسؤوليه التاريخيه للهاشميين تجاه المقدسات ياتي اهتمام الهاشميين بالقدس ومقدساتها,Positive
تليفيزيون المستقبل صار سيء للغايه ما ادري ليش,Negative
فعلا اللي بيســتحوا ماتوا,Negative
الحمد لله ما اكرمك يا الله,Positive
سبحان الله مواقف لها معنى قيمه فعلا تعلم ما شاء الله,Positive
اللهم ارضنا بما قسمته لنا,Positive
هلا كففت عن قسوتك,Negative
هاد برنامج وسوبر ستار بنامج شوف البريطان شو بعملو فعلن سوبر الهبل,Negative
فلما الحزن فلقد اصبح الحزن صديقي,Negative
كن كما انت لا تتغير من اجل احد,Positive
قول يا رب وخد قرار,Positive
الحمدلله وربنا يجعلنا من المداومين عليها والخاشعين,Positive
الدين ليس بالمظاهر الدين المعامله حياء وادب واحترام وانتقاء للالفاض الطيبه,Positive
انته جميل جدا ربنا يثبتك واتمني ان كل المسلمين تكون اخلاقياتهم في حياتهم العاديه قدوه ودعوه لكل غير المسلمين,Positive
يشبه رغد مجنونه هيافاء,Negative
الله يشافيك يعافيك من كل داء وهامه اخي سيد الوكيل,Positive
اللهم ارزقني كما ترزق البغاث,Positive
اللهم اني اعود بك من الذنوب التي تزيل نعمتك وتحول عافيتك وتحبس رزقك وتعجل بغضبك,Positive
والله انك ما زليه يا شيخ اكيد مدفوعله من تحت تحت,Negative
حتى فى التخلف مش فالحين منيح,Negative
صوته مره منبح احسه تعبان عاد زبدوله مابقى الا يطلع بعد شوي,Negative
ربي يكون بالعون ياخي فقد احزنني كلامك,Negative
ترتيب ونظام منقطع النظير في احدى مدارس الاناث بقطاع غزه,Positive
الحياه مستمره سواء ضحكت ام بكيت,Negative
يع بتقرف انت وسخ يع شوهاي الوساخه,Negative
لا تخسر قيمتك بكلمه، ولا تفقد احترامك بزله، ولا تجعل همك في الدنيا هو حب الناس لك،فالناس قلوبهم متقلبه قد تحبك اليوم و تكرهك غدا,Positive
بني البرنامج النووي الاردني على عده تصورات خاطئه بشكل خطير تتعلق بالتكنولوجيا,Negative
نعم مصر عايزه راجل مش واحد وسخ بيقرف,Negative
صحيح كل هالشغله بس قرار وبظن كلنا قادرين ناخده اذا استعنا وتوكلنا الله,Positive
بسمه امل حلوه,Positive
صبح يحكي للتلفزيون الاردني العقار في الاردن رخيص ! وجميل ... رخيص يعني بنقدر نملك شقه ب 10000,Negative
يعني يجبون كم واحد يعطونهم فلوس ويجون يستهبلوا عندهم عشان يحركون البرنامج,Negative
يعني كل جامعات الاردن عندهم نظام، و احنا عنا خرا,Negative
ليش هيك معجبين على الاردني,Negative
اصلا كتير من البنات بدهن يحكن مع الشباب,Negative
مقاسك غير مناسب يا شريف مع نفسك,Negative
شردو اطفلها وقتلوا رجالها,Negative
اه ياشويه عاهات,Negative
الحمد لله نامل من الله ان يمن علينا بالهدايه,Positive
اللهم ان كان لي عوض على صبري,Positive
طالما انك تتوجه الى الله عز وجل باستمرار فلسوف يفتح عليك اكثر مما تتخيل,Positive
الحل الوحيد هو القرب من الله وذكره الا بذكر الله تطمئن القلوب قال الله تعالى,Positive
كافر ملعون جهنم باذن الله,Negative
يا الله كلامك بلسم,Positive
الله اكبر ما احلاكم وما اشجعكم,Positive
شعب لا يحركه هذا الظلم التعدي على كرامته هو شعب لا يستحق الحياه,Negative
انا بدات اتحرك شاركت بفكره ستغير الكثير من واقعن,Positive
الله يفرح الكل ويجمع بين المتحابين على خير,Positive
القتل نهايه الزوجه اللعوب,Negative
الله يلعن ام هيك نمر,Negative
ان شاء الله هنكمل مشوار النجاح,Positive
اجتماع حواء اكيد في خرفنه ,Negative
اقرفني والله,Negative
الغلط مو من المشاركين الغلط من نفس البرنامج المفروض تكون فى مرحله فرز فى البدايه قبل لا يطلعو الهواء,Negative
وهاد اللي بخبص حكي ملوش معنا ابن مين هاد,Negative
فعلا الله يجزيك كل الخير دكتور والله يثبتنا على ديننا,Positive
الله يهدي التائهين والضالين الى طريقه,Positive
انا فعلا عملت كده والحمدلله بقيت احسن من غير الحجات الي ربنا خدها مني الحمدلله,Positive
غرباء نحن حتي في احلامنا نعيش واقع ليس لنا فيه نصيب. .؟ نتمني اشياء كثيره لكن بدون ان نتحمل اي مسؤوليه. ....ننظر الى انفسنا فقط,Negative
لانهم يمكن يكونو قاهرينك,Negative
ما شاء الله العطله ماثر عليكوا كتير صبايا الكل بحكي حبيبتي وحبي وبلمدرسه كل واحد بكشر من جهه,Negative
نعم الصديق الوفى,Positive
اذا لم تقل لا للظلم فسيستمر الى الابد,Positive
يا ارحم الراحمين يا الله,Positive
قصه رائعه ياريت كل الرجال هيك,Positive
قرفت انتحر عن الدرج,Negative
الدعوه مش بالكلام بس ممكن نكون دعاه باخلاقنا اسلوبنا تعاملنا,Positive
سوبر سطار ولا بلاش,Negative
اه لو لا القران لقلت ان انكر الاصوات لهذه الاصوات,Negative
تاثير الغرب مبين على العرب المجانين,Negative
انا علي ثقه اني استطيع فعل اي شئ لاني انا من صنع الله,Positive
كن انت التغير الذي تريد ان تراه,Positive
ملحمه بالجامعه الاردنيه,Negative
انبسط يا عم افرح,Positive
وانا مع انو الطاقه الشمسيه هي البديل,Negative
عنجد بخزي شو هاد على حساب ازياء طلع باله,Negative
ن مقابله جلاله الملك عبدالله مع قناه سي بي اس الاميركيه . يؤرقني تامين فرص الحياه الكريمه لشباب الاردن و لن نسمح للارهاب بالعبث في الاردن,Negative
والله لو يجمعونهم على شاطئ البحر الميت ويخلونهم يصرخون على اليهود ولمده 30 ثانيه ليهربون لقبرص عن طريق البحر سباحه,Negative
ياخي برنامج سامج ساذج,Negative
الدين عباره عن اخلاق وحسن التعامل مع الناس وتهذيب النفس قبل ما يكون مجموعه من العبادات !,Positive
انا معك بان دين الاسلام لكل الناس وفي كل زمان ومكان,Positive
لا بقلو بيضه حكي فارط نحن الاردنيه ما حد بيطلع معنا براس,Negative
المعنى الحقيقي لعاهاتك يا وطن,Negative
وقعنا ولا ما وقعنا يللي بدهم يعملوه بيعملوه,Negative
