text,label
لو يدرس في جامعات مصر او الاردن يعرف الدراسه والعلم الحقيقي وهناك اللي يقدرون نسبته وتفوقه,Positive
اللهم اجعل سريرتي خير من على نيتي اجعل على نيتي صالحه,Positive
فشرت عين الشيعه والله بنحرقهم حر,Negative
الواحد عايش وسط قرف,Negative
يارب تهدينا الي الصراط المستقيم يارب تقبل منا,Positive
تعليم الاطفال على الاغاني وعلى الرقص بدل من تعليم القران الكريم بدل من تعليم الدين الله لا يوفقكم,Negative
اسوء شيء ان تكذب لانك ستبدا سلسله لا نهايه لها من الاكاذيب في النهايه ستكشف,Positive
مش عاجبو الوضع الي هو فيه,Negative
هما بس الى بيسعوا للغناء ده طبعا غير الاشتغالات والافلام الهندى الى نحن شفنها,Negative
ارجوك يا استاذنا الفاضل ادعيلي بالنجاح في مسابقه المجستير العام القادم والشفاء بارك الله فيك,Positive
وياريت بتظبط الكذب ماوش رجلي,Positive
الضغوط النفسيه لها تاثير في النهايه ، سمعت قصه عن اشخاص انتحروا بسبب تعليقات ساخره ضدهم.,Negative
لو حد يا جماعه يعرف طبيب اذن يدلني ولا شكلي هارميهم خلاص باظو,Negative
ولا انا صورتي كذا اجي اهبال هوو,Negative
صراع متصاعد للهيمنه على سوق الالمنيوم العالميه,Negative
اللهم اهدنى الى ما تحب ترضى,Positive
عاهاتك يا وطني,Negative
والشكرلله والفضل لله على هذه النعمه التي انعم الله علينا بها وجعلنا من الماء كل شي حي,Positive
شو نوع الحشيش ؟؟,Negative
عني كل يعلقو الا انا,Negative
ربنا يكتر من امثالك يا مصطفى,Positive
بتقول كلام زي الفل,Positive
وسبب برفعه ضغطك,Negative
ركز في الاجابه وقول يارب وخد قرار,Positive
والله حرام يعني ما يدرون انهم مصخره,Negative
لا حول ولا قوه الا بالله ليش الحرج هدا,Negative
اللهم اصلح نفوسنا لما يرضيك عنها,Positive
ماجمل الحب الاخوه في الله ان نخاف على بعضنا حتى في علاقتنا مع ربنا شئ رائع جدا,Positive
ترى هاي فاهمه موضوع الوطنيه غلط ترى مش لحالك اردنيه والله اعلم اذا انك اردنيه اصلا شغل سوالف حصيده,Negative
اكيد طبعا حب ربنا احسن من حب اي حد وانا فعلا عملت كدا,Positive
السعي وراء الرزق عباده و جهاد,Positive
يعني هيك برامج بتبين للناس وين صرنا كم صارت نسبه التخلف بين شباب امتنا,Negative
والله انو نذل,Negative
عفكره البيج هاد قرفني وقلب معدتي شو للاسف انتا انو عرفك انه هيك الوضع بتفتح بالفنجان يا ناس خفوا علينا الدين مش للايكات وكمنتات,Negative
هو بن وسخه ادمان وبالذات لو متابع اخبار وحاجات يوميه,Negative
والله ما في اشي مزعلني الا انه اسمه محمد,Negative
من احبه الله حبب به خلقه,Positive
اللهم اجعلنا ممن ياخذون بالاسباب,Positive
قول يارب ادعي كتير انك تكره هذه المعصيه وربنا كريم,Positive
ايوه هيك بدنا ياكم يا شباب بترفعو الراس,Positive
انا عرف شيء والله ببكي اكتر ما بضحك,Negative
لا هديله بالشوز زى الصعيدى الى يكرمه الى ضربه بالشبشب ناقصه حراميه,Negative
جامعه العلوم والتكنولوجيا الاردنيه افضل من 92.7% من جامعات العالم و 98.2% من جامعات الوطن العربي طبقا لتصنيف ويب,Positive
يا ريت لو يعملوا دورات قبل الزواج,Positive
انت ما تستحي تقارن القران بوحده ساقطه انعل ابوك لا ابو الملحد,Negative
اللهم اكرمنا برضاك,Positive
والله الناس دي ما شايله هم ابدا علشان كده مسخرو نفسهم او كرامتهم راحت,Negative
صباحكم تفائل,Positive
اللهم زينا بالخلق الحسن ارزقنا الامانه نظافه القلب اللسان امين,Positive
ماكرمك يا ربي يا كريم,Positive
اللهم زيد المسلمين وبارك فيهم,Positive
السهر احد مسببات مرض السكر,Negative
من اين لنا المياه لتبريد المفاعل النووي فهو يحتاج الى نصف مليون مترا مكعبا من المياه لتبريده سنويا على الاقل والقاصي والداني يعرف اننا في بلد يعاني من شحه المياه اما كعلوم معرفه بالعلوم النوويه الطاقه فانا احب ان يتعلمها المتعلمين في بلادنا بدءا من جدول مندلييف للعناصر مرورا العناصر المشعه نظريه اينشتاين للطاقه نظريات الفيزياء الكميه البحث في عمر البروتون النيوترينو والكواركات واللبتونات وال  النظائر المشعه تفتيت الذره اشعه جاما بيتا الفا الراديوم البلوتونيوم البروتونات كافه النظريات بما فيها انواع المفاعلات النوويه تجارب الامم فيها مثل اليابان المانيا روسيا فرنسا امريكا للعلم فقط انها علوم نظريا سهله بسيطه يستطيع فهمها حتى الانسان ذو الخلفيه الرغبه العلميه على جميع او على الاقل جزء من علمائنا ان يقرروا المسار الذي يجب ان نسلكه نسير فيه بهذا الخصوص بموازنه المخاطر المكاسب بعدها على اساس النتيجه الفائده الواضحه يتم الاعتماد لقرارهم ان كان سلبا ام ايجابا,Negative
شوف شكلك بالاول بعدين احكي,Negative
يارب وانت ادعيلي,Positive
انت واحد حقير,Negative
دعواتك لنا يا شيخ سلمان بالتوفيق الفلاح الظفر حسن الخاتمه,Positive
نعم احسنت واجبه على كل مسلم وحق لكل مسلم فتح الله عليكم,Positive
يا الله ارحم عبدك الفقير المسكين وجميع المسلمين والمسلمات,Positive
شو يعني بدك ايانا نحكي من وراكي مش حلوه,Negative
ليتنا نستطيع الابتسامه في الاوقات المؤلمه,Positive
مفيش اكرم ولا ارحم من ربنا,Positive
وزير التعليم العالي: لا زياده للدعم المالي للجامعات خلال السنوات الثلاث المقبله,Negative
لا يشكي قله المال لكنه يشكو امانه الرجال,Positive
لا هديله بالجزمه طبعا,Negative
اللهم اغفر لنا انا كنا ظالمين ادخلنا الجنه سالمين,Positive
كلب وحقير,Negative
تبون تقنعونا انكم تخافون على صحه المدخن وعلشان كذا رفعتوا السعر..بيشترونه ولو ب100 دينار  وبيدخنون ولو بعظم وورق شجر,Negative
حظ من ينعم بمحبه الصغار قبل الكبار ، لان محبتهم صادقه ومن القلب,Positive
كنت اشوف الاجانب اقول موسوسين,Negative
طموح الانسان يدفه لتحقيق اهدافه يا رت شببنا ما يقولن فات الوقت الله يوفق من يشاء,Positive
صباح الحب من الله علينا جميعا,Positive
السلام عليكم الحقيقه انا لا اعرف شو وقاحه هاي اللجنه المشترك يعطي ما عنده من مواهب هذا ما عنده وهم يعطون ما عندهمما,Negative
العاهات اللي عندهم ياناس روحو موتو اشرف,Negative
والله ظلموه لجنه الطراطير,Negative
تقول داخله فيها ترله انحولت مع الاغنيه,Negative
شكرا لك,Positive
ونعم بالله من اختار قرب الله فما خاب ابدا الله على دى راحه وده شعور الحمد لل,Positive
من جد مجنون,Negative
اللي لفت انتباهي الدبه اللي جنبها,Negative
اذا كان المدير يخاف من معلم مبدع وكان زملاء العمل يحاربون هذا المعلم فهم في الحقيقه ينتقصون من حظ طلابه,Negative
من ضحك عليك وحكالك صوتك حلو,Negative
تم تنفيذ الحكم الي في الرد الاول وتم اعدام اول راس والباقي بالطريق,Negative
خت قرار كتير وبرجع تاني بحاول اتغير ومش عرفه,Positive
جزاك الله كل خير بسمه امل رائعه وشيقه جد,Positive
نسال الله العفو العافيه,Positive
ولك تفيييه عليك,Negative
سبحان الله قادر على كل شىء,Positive
احسن اظن بالله وتوكل عليه وحده,Positive
انا اردني بقول الشعب بيستاهل غلا اكثر من هيك,Negative
الله يبارك لنا فى ايامنا,Positive
الله يزيدك من العلم ما تنتفع به الامه,Positive
هذول مخانيث,Negative
حلوه اوى الحمله دي وربنا يارب يكرمك وكل الي بيتبرعو,Positive
ربنا يقويكى على اخد القرار الصح واحسنى الظن بالله وتوكلى عليه وربنا يقويكى على ضعفك يارب ويعدك عن الغلط ده,Positive
انا اقدر الاخلاص الوفاء بشكل كبير,Positive
اللهم قني شر نفسي,Positive
جسمها حلو ترقص عاريه,Negative
اللهم انى اقسمت عليك بك ان تهدى شباب المسلمين وتنور قلوبهم كما انعمت على طارق بنعمه الاسلام,Positive
وسدئيني انكووو كلاب,Negative
عطله 15 يوم وكمان اسبوع عطله و 20 دينار لكل طالب هاي مدرسه ولا شهر عسل,Negative
اما وهابيتك فحدث ولا حرج الناس يقادون الى المساجد غصبا ويجلدون كالابقار ان هم ابوا,Negative
اكرمك الله يا استاذي الفاضل,Positive
لكل مجتهد نصيب ... من لديه هدف ويثابر عليه حتما بعد امر الله سوف يصل,Positive
كثر الله من امثالك زادك الله علم,Positive
يجب وضع كل من تسول له نفسه مجرد ان يعمل اي تصرف لا يليق بالاردن ان يسجن يسجن شىء مخزي شويه همل زعران يخربوا الجامعات سمعه البلد,Negative
الحمد لله رب العالمين على عطاه رضا,Positive
شو بالا يا دانيا المشكله مش عارفه تكتب هعهعه,Negative
اللهم ارزقنا الاخلاص في القول العمل في السر العلن في الرخاء الشده في العافيه المرض عند الابتلاء,Positive
الحب الان بقى تيك اواى قليل اوى لما نلقى انسان مخلص فى حبه مع ان الحب ده اجمل واسما عاطفه فى الوجود,Positive
و ما من دابه في الارض لا طائر يطير بجناحيه الا على الله رزقه,Positive
مهزله التاريخ,Negative
ما اقسى غربه الروح,Negative
اللهم انا نعوذ بك من الرياء النفاق,Positive
الله يجعل ابوك وامك من اهل النار اذا بتعيد هالحركه مره ثانيه,Negative
انته والمعك كلهم سافلين ووقحين,Negative
عاهاتك ياعرب,Negative
صباح الدرب للجنه,Positive
صباحك خير يا دكتور سلمان,Positive
وين بدهم يروحو يعني خالصه,Negative
نعم والحمد لله,Positive
صراحه بخزي من دون مجامله,Negative
الله يسعد كل البشر امين يا رب,Positive
نفع الله بك يا دكتور,Positive
منيك ولك,Negative
بالمناسبه انا مؤدب جدا ، لا احتسى الكحول ولا ابحث عن علاقات مشبوه,Positive
واحد هامل,Negative
المشاركين بينو للناس انه اللى قايمين على البرنامج حمير,Negative
يارب يتقبل منا والله العقل مو فاضي والقلب مكسور,Positive
الي استحو ماتو,Negative
اللهم ثبت قلوبنا على الايمان,Positive
لا للمفاعل داخل الاردن,Negative
الله الله على اخلاق الصحابه اصحاب رسول الله,Positive
عرب اغبياء,Negative
يارب قربني اليك واقترب لي اكثر,Positive
احيانا الوحده تزيل بعضا من الهموم,Positive
اه يا ابو القمل,Negative
ودي اكسر الابتوب على راسه,Negative
يا غبي كوادر الاخوان المسلمين في كل بقعه من هالارض,Negative
قريبا ان شاء لله تسمع اخبار تسركم,Positive
رهيب حسن تعالى تعالى,Negative
سخافه الشاميين ابدا ما ينفع لهم الكوميديا,Negative
مع مرور والوقت  وزياده الالتزامات والمسؤوليات قد تنسى ما كنت تستمع,Negative
بالله يا شباب وش رايكم بالاشكال هذه هل تتوقعون اهلهم كارهينهم والناس تجي لاهاليهم وتقول لهم حرام عليكم هذول من دمكم,Negative
وهاي المضروبه جايخه على وين,Negative
عجل يا الله,Positive
اساس الاصلاح واهم مرتكزاته المعلم داخل غرفه الصف مع طلابه وتلاميذه والاعتماد عليه بالتنفيذ لخطط واستراتيجيات عليا,Positive
روعه الاشياء تبقى روائحها بقى اصحابها ام انصرفوا,Positive
يارب ارزق العزيمه لاتخاذ القرار ويا رب اخلفنا خيرا منه,Positive
شكرا لجميل اثراءك المعرفي، كلامك وسلاستك في ايصال المعلومه جميله للغايه,Positive
مش طبيعي سماكه الدم شو ها عدوله خرب المفطع لشو المبالغه والاوفر يعني,Negative
كل شئ في حب الله تهون وحب ربنا اقوى بكتير من اى حاجه,Positive
ايس شراع القرف,Negative
شكلو عمرو ماشاف كاميرا تصورو,Negative
انا حاسه انه قلبى مليان وعامر بنور الله,Positive
سبحان الله اللهم ارزقنا الطمانينه اليقين,Positive
احسن شيء العمل الذي يؤدي للاستمراريه,Positive
اللهم حسننا حسن اعمالنا ظاهرا باطنا لا تجعلنا نعمل الا ما يرضيك عنا برحمتك يا ارحم الراحمين,Positive
والغناء تجد لك ??? مليون وكلهم زباله,Negative
مافى اجمل من قوله يارب ومن يتجه الى الله عز وجل لن يتركه الله ابدا,Positive
مياعه وسئاله من عدوله والي معو,Negative
نفسي يوم اكل وانا مش مستعجله,Negative
احذفه لاني بجلس احش فيهم لمين اكفر,Negative
يارب عوضنا خير مما اخذ منا,Positive
لهل درجه في متخلفين في الوطن العربي؟؟؟؟؟؟,Negative
و اذا فادنا بشي رح يكون في خساره كبيره بالاخر,Negative
الفن اصبح هابط هذه الايام,Negative
ما حد بيتحكم فيي,Negative
ملعوب عليهم,Negative
شو هل الاهبل,Negative
الله ياريت يبقى فى اخلاق كده فى الوقت ده,Positive
لازم اخر ما توصل اليه العقل البشري من غباء اخوكم حمزه اللهواني من الاردن,Negative
سلمت امري ربي عالمين رغم البعد احس ان ربنا رح يكتب ويجمعنا ويكون نصيبي,Positive
ما شاء الله ... ونعم التعليم في الاردن .... ابدعوا الشباب !!!,Positive
جورج وسوف حلب مو طبيعي,Negative
الله على الظالمين,Negative
ما شاء الله والله انها امر متل الكرتون,Negative
الله يثبتك ينور طريقنا,Positive
طبعا اكيد والف,Positive
ما اجمل الصبر الاصرار,Positive
حقا مزبوط صدقت,Positive
والله شككني في البرنامج انه سوبر ستار او برنامج كوميدي,Negative
شكرا للنجمه الراقيه كنزه اخبار النجوم,Positive
المشكله في ناس تقنع حالها انه جورج وسوف له علاقه بالاغاني,Negative
مبرد وجوهكم,Negative
و تربت على كتوفنا تشحننا بالتفاؤل ايضا صباحك اسعد,Positive
كلام حقيقي,Positive
اشرب من كاس المر,Negative
اللهم اجعلنا دائما مسلمين صادقين في افكارنا في اعمالنا,Positive
اذا فكرت مره تخسر اصحابك يا ليت تخسّرهم على احد يستاهل، صح الحياه تعطيك ميه حُب بس الحياه ما تهديك اصّحاب مرتيّن,Negative
وقّـف قلبو لحسن الشافعي,Negative
ما هيك بيقولوا للاسف ما عجبت حدا انت جاهل يا هذا ليس هكذا تدعو الناس لقول لا اله الا الله محمد رسول الله انت غبي يا صاحبل هذا البوست لا تفقه شيئا من العلم الدين انت هيك تبين انك في قمه الجهل العار قل كلاما جيدا محببا لا تتلفظ بالكلام السيئ انما تعجبنا كلنا لو قلت انطقوا بالشهادتين يا اولي الالباب,Negative
ما ازنخ منك الى هاي اللينكات اللي بتسم البدن بتتعب يعني لما توخد الصوره وتنزلها تنزيل عادي,Negative
جهنم وباس المصير,Negative
طبعا محدش يقدر بس سبحان الله فيه ناس عايشين من غير مياه,Positive
الله يلعن الي علمكم التطور يا متخلفين يا رجعيين,Negative
شفتها اقول وشذا الكيك,Negative
اللهم اذقنا حبا رائعا حلالا طاهر,Positive
ربنا يكرمك على سعيك وحُبك للمُساعده,Positive
بلد يديرها اغبياء حراميه,Negative
نسمات انتعاش الفجر رحمات يظفر بها اهل النور التام الذين توسعت صدورهم بانشراح جماعه الفجر حيويه صبح يتنفس منتشيا مرحبا بكل مبادر للخير,Positive
انتم يا قطريه شن عارفكم السياسه انتم لاعندكم جيش ولا استراتجيه ثابته انتم عملاء امريكا يا خونه,Negative
الله اكبر والعزه للسلام,Positive
حيوان وكلب الله يموتك,Negative
نحن في زمن يهان فيه المرء ويكرم فيه الكلب,Negative
مالكيش ف الطيب نصيب,Negative
قصه جميله ودايما انا بحب اسمع البرنامج,Positive
البيت اللي فيه فرح سعاده دايما بكون متفائل سعيد بحاضره مستقبله,Positive
لا محاله اول شيء يحدث له بعد عودته للمغرب سيتم اغتصابه كالعاهره,Negative
فالاول يصحح مساري الثاني يزيد من اصراري,Positive
بس الحكام ماعندهم ذوق للاسف,Negative
ناقص و كذاب وما في مصداقيه,Negative
اليك يا ربي قلبا لم يستعن بسواك، ياوي اليك لترضى ويهتدي بهداك,Positive
قصه جميله جدا تعكس معنى الايمان التمسك بالعقيده الصحيحه حسن تعاليمها,Positive
كنا نقول عاهات,Negative
خلتنى اضحك رغم انى مكتئبه جدا,Positive
ما بقى للسحيجه اشي يسترزقوا منه ،فضائح شركه الولاء وموارد والفوسفات والفساد عادت الى الواجهه .,Negative
ما اروع برنامج الطريق الى الله,Positive
اللهم اسمعنا خير هذا اليوم و ما بعده و افتح لنا ابواب رزقك و رحمتك,Positive
صباح كل جميل في هذا الكون,Positive
يعني دوله اللي  من وين جاي كيف وصل عشان تشوفه لجنه التحكيم مبين عليه مجنون مش شايف اشي قدامه,Negative
اهما ودهم يروحون النار لكن النار مارضت فيهم,Negative
ليش معصب يا عدوله,Negative
سبحان الله له فى خلقه شؤون,Positive
قصه حقيقيه رائعه فيها عبره لكل زوج وزوجه فيها الموده والرحمه,Positive
انسان غريب,Negative
اللهم هون برد الشتاء على عبادك المستضعفين في كل مكان ،اللهم انـزل دفئك ورحمتـك على كل فقيـر لا ماوى له,Negative
الدال على الخير كفاعله,Positive
فعلا الله يبعدنا عن الكذب,Positive
لا مو حقودين ولا شي,Negative
امين يا رب انت شاب زي الفل ما شاء الله عليك,Positive
ما شاء الله على هلتفائل الي عنده,Positive
اخبار مسخره,Negative
انا مِا اغيب الا اذا كرهّت اني ابقى راجع افعالك قبل كُل حاجه,Negative
ناس مطفره من الاخر,Negative
صباح الامتحانات,Negative
قمه التخلف والانحطاط,Negative
الا يكفي ان نسبه مرضى السرطان في الاردن اعلى نسبه عالميه بسبب مفاعل دايمونه الاسرائيلي بكل جهل نضعهه في بلدنا,Negative
كله على راس المواطن ما يثير السخريه رفع اسعار المستقات النفطيه المستخدمه في الصناعه تقول صناعتنا مكسره الدنيا,Negative
المراه تهان وتعامل كاداه جنسيه تحت مسميات عديده كالمسيار والمسفار والمصياف الخ وكلو بتمنو,Negative
تفائلوا بالخير تجدوه اعملوا الصالحات,Positive
اصواتهم مع التوتر خربت,Negative
هع مش حلو,Negative
وانا من الناس اللي فعلا محتاجين يحاسبوا نفسهم ويصلحو من نفسهم لاننا عارفين انه لا ملجا لنا الا لله,Positive
بعدين الاردن تسبح على بحر من النفط الصخر الزيتي اشتغلو فيه بالاول بيكفينا 100 سنه,Negative
عليك بتقوى الله ان كنت غافلا,Positive
لو نريد الخشوع حقا نطلق الدنيا,Positive
متهور وكذاب,Negative
الحب بين الزوجين اوسع ابواب السعاده,Positive
لن تموت نفس حتى تستكمل رزقها اجلها,Positive
اي تقدم اي ازدهار مفاعل النوويه بعمل الامراض كثير اهم السرطان الله يبعده عنها انا معهم رفض المفاعل النوويه,Negative
محششين خخخخ,Negative
كيف صرت كاتب يا زلمه ؟؟ انت كثير عليك حمار,Negative
طريق واحد عدم اليئس هو طريق النجاح,Positive
ربنا يحمى الاسلام والمسلمين,Positive
غبي من جده,Negative
جمهور لا يياس الى اخر ثانيه,Positive
بعين الله يا امال كلهن ستين سبعين سنه وبمضن وبتهون,Negative
نحن في الاردن نشاطر اخواننا في السعوديه احزانهم بوفاه الامير  سعود الفيصل وزير الخارجيه السعودي السابق انا لله وانا اليه راجعون,Negative
مجانين احد يضحك عليك وانتم قدامه وتكمل,Negative
اللهم اجعلنا منهم وارزقنا الطاقه ولاراده لزللك ياربى,Positive
الحمدلله على كل حال، الفرصه قائمه، والقادم اجمل,Positive
يارب كرهنى وابعدنى فيما يغضبك,Positive
اضحك وفرفش لكن  بحب واداب اعرف حدود المزح واعرف محله,Positive
تماما اللهم لا تحرمنا الصدق في الكلام,Positive
يا الله عالمواساه يرحم ايام زمان,Positive
